"78c09656","I was basing it off how many stores were profitable or not profitable outside of the 20/-20 area. I believe I was putting too much into the lower side of the profit graph, and over compensating. Which I would do differently if I were to do it again.","data-only","-18520",-617.333333333333
"063eacc0","I counted the amount of points above and below the red line. If there was more less than 7 points below the line I marked the graph as profitable.","data-only","-890",-29.6666666666667
"781508c6","If the mean was above 0, selected. ","pdf","-20470",-682.333333333333
"080f8198","first i'd see which side had most points, but then if it was close OR if sides had a noticeable quantity of points further from 0 i'd weigh them higher, as 1 point at lets say 25 is worth 10x points around the 2.5 mark.","data-only","-21530",-717.666666666667
"6911046e","If the marker was smaller and in the profit region that I chose profit","ci-50","-8190",-273
"91e298b2","If the bar dropped below the red line at all, and the location of the point.","ci-50","-10190",-339.666666666667
"26c02061","looked at number above/below line and spread of them. Better clustering suggested more consistency","data-only","-15610",-520.333333333333
"00c1f1a4","I looked to see on average how much of the shape was under the profit line, as well as the point. If the point was above, and most of the shaded area was above the line, it was profit, it it was mostly below, it was loss.","pdf","620",20.6666666666667
"ade5438c","chose the ones that had more data above zero","data-only","-5070",-169
"a0e4fb47","Seeing where the mean for each region was. For those that were borderline, I tended to say 'not profitable' to lose less money.","pdf","-9880",-329.333333333333
"acb51347","Looking at the general shape of the dots and guessing where the centre point would be for the mean. If it seemed close, counting the dots below the zero. Ignoring the score as it just went relentlessly down!","data-only","-3680",-122.666666666667
"44f80a24","If the peak of the curve was 4 or higher, I would assume it was profitable.  Otherwise, I would prefer to play it safe, knowing the penalities.","pdf","880",29.3333333333333
"ff63d5ff","If borderline choose non-profitable, but beware of the length of the line on the graph.  Shorter lines mean that the results are more clustered and longer lines imply uncertainty.","ci-50","930",31
"0abd8ac7","I tried to just where the majority of the portion was in comparison to the red line, if more so in profit margin, I would guess profitable. ","pdf","-2420",-80.6666666666667
"6c6711af","I wasn't willing to risk that the stores were profitable if it was borderline.  I'd rather lose less points if I said they were non profitable than more points is they turned out to be profitable.","pdf","1780",59.3333333333333
"a5eca292","if the graph showed more profit than loss I went with profit","data-only","-13770",-459
"7875b05d","I selected the region where the dots were the widest as this seemed likely to have the highest population of dots although I only adopted this after the first round of trials.","data-only","-18460",-615.333333333333
"116f3327","more points above the red line showed it was profitable","data-only","-17500",-583.333333333333
"296582c9","Visually judged whether most dots were above or below the profit line.","data-only","-17380",-579.333333333333
"cc403b67","Trying not to loose, rather than trying to gain.","pdf","1690",56.3333333333333
"989d7e76","On the first trial I just chose anything above the line but afterwards I felt anything too close to the line even if it was above I should choose non profitable. ","ci-50","-3150",-105
"e8a5c3fd","Amount of dots in profit/no profit regions and how high they are","data-only","-17860",-595.333333333333
"3d29588e","Started by looking for the widest part of the bell curve to be above 0 so that on average I'd be right. I then saw I was losing more points this way so i had to be more cautious and only selected profitable if it was much further above 0 line.","pdf","-2390",-79.6666666666667
"eb5da98f","I tried to see if the majority of the plot was above the 0 line. ","pdf","670",22.3333333333333
"5d0064c2","i tried to see if the number of dots above the line was higher than below the line ","data-only","-3690",-123
"11bba01d","If the mean was above 0, I chose profitable. If the mean was below 0, I chose not profitable. Based on my -24000 points, it seems like this wasn't always true...","pdf","-24000",-800
"52bd0eee","Eyeballing and gut feel","data-only","-15150",-505
"2a5dff9c","First, I used simple method of checking if the line was mostly above 0, and classing it as a profitable store, and if mostly below as not profitable. I then changed to see how many points I was losing at a time since I was never gaining. I tried using proximity of the line to 0. If it was close or touching I placed the region store as failing. Then I tried measuring with the dot depending on the side it was on would determine if the store was profitable or not profitable. I think I was losing less points when I classed when the line/dot was close or touching 0 as not profitable even if it was above the line, or mostly above and still touching it.","ci-50","-14300",-476.666666666667
"cdd282a6","I marked them as profitable if thet were a good way into the profitable zone","pdf","250",8.33333333333333
"4132e741","I counted the number of dots that were above the red line and the ones below and if there were more above the line i clicked that they were profitable and if there were more below the line I clicked not profitable","data-only","-23420",-780.666666666667
"4c5ca131","Focusing on the central tendency (mean) within the confidence intervals and basing my assessment on that.","ci-50","-20820",-694
"d9b38665","Not profitable: anything below or touching the red line as well as below the first grey line above the red line. Profitable: only if it was above the grey line above the red line.","ci-50","470",15.6666666666667
"3ce2a645","I figured the more dots above the red line there were, the more profitable the store was","data-only","-2370",-79
"5a8b740c","If the average shown was over 5, then I marked it as profitable. I also marked it if the variability was low and the average was close to this threshold.","ci-50","2260",75.3333333333333
"70321cd3","If black line below zero no profit","ci-50","-9530",-317.666666666667
"f99b147a","i was looking at where the marker was compared to the line and how big in size the marker was. larger marker = higher profit i thought","ci-50","-13640",-454.666666666667
"5656c588","According to instructions","ci-50","-20230",-674.333333333333
"8ab2da32","I'm sorry, but there was no real way of making informed decisions with the data presented, I'd say the task is absolutely impossible","ci-50","-5210",-173.666666666667
"c4f0435a","I checked the size of the graphs along with the position and decided using a combination of the two which outcome was most likely","pdf","-10560",-352
"25abe7ed","tried to maximise returns by the score value of profit/non profit","pdf","-14700",-490
